title,pdf_url,arxiv_url,code_available,code_url
"Temporal-aware Query Routing for Real-time Video Instance Segmentation",https://openaccess.thecvf.com/content/ICCV2025/papers/Cheng_Temporal-aware_Query_Routing_for_Real-time_Video_Instance_Segmentation_ICCV_2025_paper.pdf,,no,
"Accelerating Diffusion Sampling via Exploiting Local Transition Coherence",https://openaccess.thecvf.com/content/ICCV2025/papers/Zhu_Accelerating_Diffusion_Sampling_via_Exploiting_Local_Transition_Coherence_ICCV_2025_paper.pdf,http://arxiv.org/abs/2503.09675,maybe,
"What Changed? Detecting and Evaluating Instruction-Guided Image Edits with Multimodal Large Language Models",https://openaccess.thecvf.com/content/ICCV2025/papers/Baraldi_What_Changed_Detecting_and_Evaluating_Instruction-Guided_Image_Edits_with_Multimodal_ICCV_2025_paper.pdf,http://arxiv.org/abs/2505.20405,maybe,
"Saliency-Aware Quantized Imitation Learning for Efficient Robotic Control",https://openaccess.thecvf.com/content/ICCV2025/papers/Park_Saliency-Aware_Quantized_Imitation_Learning_for_Efficient_Robotic_Control_ICCV_2025_paper.pdf,http://arxiv.org/abs/2505.15304,no,
"Where am I? Cross-View Geo-localization with Natural Language Descriptions",https://openaccess.thecvf.com/content/ICCV2025/papers/Ye_Where_am_I_Cross-View_Geo-localization_with_Natural_Language_Descriptions_ICCV_2025_paper.pdf,http://arxiv.org/abs/2412.17007,yes,https://github.com/yejy53/CVG-Text
"Boost 3D Reconstruction using Diffusion-based Monocular Camera Calibration",https://openaccess.thecvf.com/content/ICCV2025/papers/Deng_Boost_3D_Reconstruction_using_Diffusion-based_Monocular_Camera_Calibration_ICCV_2025_paper.pdf,http://arxiv.org/abs/2411.17240,no,
"GTR: Guided Thought Reinforcement Prevents Thought Collapse in RL-based VLM Agent Training",https://openaccess.thecvf.com/content/ICCV2025/papers/Wei_GTR_Guided_Thought_Reinforcement_Prevents_Thought_Collapse_in_RL-based_VLM_ICCV_2025_paper.pdf,http://arxiv.org/abs/2503.08525,no,
"Multi-view Gaze Target Estimation",https://openaccess.thecvf.com/content/ICCV2025/papers/Miao_Multi-view_Gaze_Target_Estimation_ICCV_2025_paper.pdf,http://arxiv.org/abs/2508.05857,maybe,
"Semantic Discrepancy-aware Detector for Image Forgery Identification",https://openaccess.thecvf.com/content/ICCV2025/papers/Wang_Semantic_Discrepancy-aware_Detector_for_Image_Forgery_Identification_ICCV_2025_paper.pdf,http://arxiv.org/abs/2508.12341,yes,https://github.com/wzy1111111/SSD
"CapeLLM: Support-Free Category-Agnostic Pose Estimation with Multimodal Large Language Models",https://openaccess.thecvf.com/content/ICCV2025/papers/Kim_CapeLLM_Support-Free_Category-Agnostic_Pose_Estimation_with_Multimodal_Large_Language_Models_ICCV_2025_paper.pdf,http://arxiv.org/abs/2411.06869,yes,https://github.com/Junhojuno/CapeLLM
"VisHall3D: Monocular Semantic Scene Completion from Reconstructing the Visible Regions to Hallucinating the Invisible Regions",https://openaccess.thecvf.com/content/ICCV2025/papers/Lu_VisHall3D_Monocular_Semantic_Scene_Completion_from_Reconstructing_the_Visible_Regions_ICCV_2025_paper.pdf,http://arxiv.org/abs/2507.19188,no,
"Controllable 3D Outdoor Scene Generation via Scene Graphs",https://openaccess.thecvf.com/content/ICCV2025/papers/Liu_Controllable_3D_Outdoor_Scene_Generation_via_Scene_Graphs_ICCV_2025_paper.pdf,http://arxiv.org/abs/2503.07152,yes,https://github.com/yuhengliu02/control-3d-scene
"JPEG Processing Neural Operator for Backward-Compatible Coding",https://openaccess.thecvf.com/content/ICCV2025/papers/Han_JPEG_Processing_Neural_Operator_for_Backward-Compatible_Coding_ICCV_2025_paper.pdf,http://arxiv.org/abs/2507.23521,yes,https://github.com/WooKyoungHan/JPNeO
"DPoser-X: Diffusion Model as Robust 3D Whole-body Human Pose Prior",https://openaccess.thecvf.com/content/ICCV2025/papers/Lu_DPoser-X_Diffusion_Model_as_Robust_3D_Whole-body_Human_Pose_Prior_ICCV_2025_paper.pdf,,no,
"Learning 4D Embodied World Models",https://openaccess.thecvf.com/content/ICCV2025/papers/Zhen_Learning_4D_Embodied_World_Models_ICCV_2025_paper.pdf,http://arxiv.org/abs/2504.20995,no,
"FlowTok: Flowing Seamlessly Across Text and Image Tokens",https://openaccess.thecvf.com/content/ICCV2025/papers/He_FlowTok_Flowing_Seamlessly_Across_Text_and_Image_Tokens_ICCV_2025_paper.pdf,http://arxiv.org/abs/2503.10772,yes,https://github.com/TACJu/FlowTok
"PROGRESSOR: A Perceptually Guided Reward Estimator with Self-Supervised Online Refinement",https://openaccess.thecvf.com/content/ICCV2025/papers/Ayalew_PROGRESSOR_A_Perceptually_Guided_Reward_Estimator_with_Self-Supervised_Online_Refinement_ICCV_2025_paper.pdf,http://arxiv.org/abs/2411.17764,no,
"UniOcc: A Unified Benchmark for Occupancy Forecasting and Prediction in Autonomous Driving",https://openaccess.thecvf.com/content/ICCV2025/papers/Wang_UniOcc_A_Unified_Benchmark_for_Occupancy_Forecasting_and_Prediction_in_ICCV_2025_paper.pdf,http://arxiv.org/abs/2503.24381,maybe,
"AdaHuman: Animatable Detailed 3D Human Generation with Compositional Multiview Diffusion",https://openaccess.thecvf.com/content/ICCV2025/papers/Huang_AdaHuman_Animatable_Detailed_3D_Human_Generation_with_Compositional_Multiview_Diffusion_ICCV_2025_paper.pdf,http://arxiv.org/abs/2505.24877,no,
"ReCamMaster: Camera-Controlled Generative Rendering from A Single Video",https://openaccess.thecvf.com/content/ICCV2025/papers/Bai_ReCamMaster_Camera-Controlled_Generative_Rendering_from_A_Single_Video_ICCV_2025_paper.pdf,http://arxiv.org/abs/2503.11647,yes,https://github.com/KwaiVGI/ReCamMaster
"MaskHand: Generative Masked Modeling for Robust Hand Mesh Reconstruction in the Wild",https://openaccess.thecvf.com/content/ICCV2025/papers/Saleem_MaskHand_Generative_Masked_Modeling_for_Robust_Hand_Mesh_Reconstruction_in_ICCV_2025_paper.pdf,http://arxiv.org/abs/2412.13393,maybe,
"Image-Guided Shape-from-Template Using Mesh Inextensibility Constraints",https://openaccess.thecvf.com/content/ICCV2025/papers/Tran_Image-Guided_Shape-from-Template_Using_Mesh_Inextensibility_Constraints_ICCV_2025_paper.pdf,http://arxiv.org/abs/2507.22699,yes,https://github.com/dvttran/nsft
"Confound from All Sides; Distill with Resilience: Multi-Objective Adversarial Paths to Zero-Shot Robustness",https://openaccess.thecvf.com/content/ICCV2025/papers/Dong_Confound_from_All_Sides_Distill_with_Resilience_Multi-Objective_Adversarial_Paths_ICCV_2025_paper.pdf,,no,
"NGD: Neural Gradient Based Deformation for Monocular Garment Reconstruction",https://openaccess.thecvf.com/content/ICCV2025/papers/Dasgupta_NGD_Neural_Gradient_Based_Deformation_for_Monocular_Garment_Reconstruction_ICCV_2025_paper.pdf,http://arxiv.org/abs/2508.17712,no,
"Learned Image Compression with Hierarchical Progressive Context Modeling",https://openaccess.thecvf.com/content/ICCV2025/papers/Li_Learned_Image_Compression_with_Hierarchical_Progressive_Context_Modeling_ICCV_2025_paper.pdf,http://arxiv.org/abs/2507.19125,yes,https://github.com/lyq133/LIC-HPCM
"U-ViLAR: Uncertainty-Aware Visual Localization for Autonomous Driving via Differentiable Association and Registration",https://openaccess.thecvf.com/content/ICCV2025/papers/Li_U-ViLAR_Uncertainty-Aware_Visual_Localization_for_Autonomous_Driving_via_Differentiable_Association_ICCV_2025_paper.pdf,,no,
"CF3: Compact and Fast 3D Feature Fields",https://openaccess.thecvf.com/content/ICCV2025/papers/Lee_CF3_Compact_and_Fast_3D_Feature_Fields_ICCV_2025_paper.pdf,http://arxiv.org/abs/2508.05254,no,
"Joint Self-Supervised Video Alignment and Action Segmentation",https://openaccess.thecvf.com/content/ICCV2025/papers/Ali_Joint_Self-Supervised_Video_Alignment_and_Action_Segmentation_ICCV_2025_paper.pdf,http://arxiv.org/abs/2503.16832,no,
"2.5 Years in Class: A Multimodal Textbook for Vision-Language Pretraining",https://openaccess.thecvf.com/content/ICCV2025/papers/Zhang_2.5_Years_in_Class_A_Multimodal_Textbook_for_Vision-Language_Pretraining_ICCV_2025_paper.pdf,,maybe,
"Learning 3D Scene Analogies with Neural Contextual Scene Maps",https://openaccess.thecvf.com/content/ICCV2025/papers/Kim_Learning_3D_Scene_Analogies_with_Neural_Contextual_Scene_Maps_ICCV_2025_paper.pdf,http://arxiv.org/abs/2503.15897,maybe,
"Are They the Same? Exploring Visual Correspondence Shortcomings of Multimodal LLMs",https://openaccess.thecvf.com/content/ICCV2025/papers/Zhou_Are_They_the_Same_Exploring_Visual_Correspondence_Shortcomings_of_Multimodal_ICCV_2025_paper.pdf,http://arxiv.org/abs/2501.04670,maybe,
"FlowSeek: Optical Flow Made Easier with Depth Foundation Models and Motion Bases",https://openaccess.thecvf.com/content/ICCV2025/papers/Poggi_FlowSeek_Optical_Flow_Made_Easier_with_Depth_Foundation_Models_and_ICCV_2025_paper.pdf,http://arxiv.org/abs/2509.05297,yes,https://github.com/mattpoggi/flowseek
"EventUPS: Uncalibrated Photometric Stereo Using an Event Camera",https://openaccess.thecvf.com/content/ICCV2025/papers/Liang_EventUPS_Uncalibrated_Photometric_Stereo_Using_an_Event_Camera_ICCV_2025_paper.pdf,,no,
"WildSAT: Learning Satellite Image Representations from Wildlife Observations",https://openaccess.thecvf.com/content/ICCV2025/papers/Daroya_WildSAT_Learning_Satellite_Image_Representations_from_Wildlife_Observations_ICCV_2025_paper.pdf,http://arxiv.org/abs/2412.14428,no,
"Flow to the Mode: Mode-Seeking Diffusion Autoencoders for State-of-the-Art Image Tokenization",https://openaccess.thecvf.com/content/ICCV2025/papers/Sargent_Flow_to_the_Mode_Mode-Seeking_Diffusion_Autoencoders_for_State-of-the-Art_Image_ICCV_2025_paper.pdf,http://arxiv.org/abs/2503.11056,maybe,
"UniPhys: Unified Planner and Controller with Diffusion for Flexible Physics-Based Character Control",https://openaccess.thecvf.com/content/ICCV2025/papers/Wu_UniPhys_Unified_Planner_and_Controller_with_Diffusion_for_Flexible_Physics-Based_ICCV_2025_paper.pdf,http://arxiv.org/abs/2504.12540,no,
"SPADE: Spatial-Aware Denoising Network for Open-vocabulary Panoptic Scene Graph Generation with Long- and Local-range Context Reasoning",https://openaccess.thecvf.com/content/ICCV2025/papers/Hu_SPADE_Spatial-Aware_Denoising_Network_for_Open-vocabulary_Panoptic_Scene_Graph_Generation_ICCV_2025_paper.pdf,,maybe,
"Few-Shot Pattern Detection via Template Matching and Regression",https://openaccess.thecvf.com/content/ICCV2025/papers/Jo_Few-Shot_Pattern_Detection_via_Template_Matching_and_Regression_ICCV_2025_paper.pdf,http://arxiv.org/abs/2508.17636,no,
"Humans as Checkerboards: Calibrating Camera Motion Scale for World-Coordinate Human Mesh Recovery",https://openaccess.thecvf.com/content/ICCV2025/papers/Yang_Humans_as_Checkerboards_Calibrating_Camera_Motion_Scale_for_World-Coordinate_Human_ICCV_2025_paper.pdf,http://arxiv.org/abs/2407.00574,maybe,
"Leveraging BEV Paradigm for Ground-to-Aerial Image Synthesis",https://openaccess.thecvf.com/content/ICCV2025/papers/Ye_Leveraging_BEV_Paradigm_for_Ground-to-Aerial_Image_Synthesis_ICCV_2025_paper.pdf,http://arxiv.org/abs/2408.01812,maybe,
"Deciphering Cross-Modal Alignment in Large Vision-Language Models via Modality Integration Rate",https://openaccess.thecvf.com/content/ICCV2025/papers/Huang_Deciphering_Cross-Modal_Alignment_in_Large_Vision-Language_Models_via_Modality_Integration_ICCV_2025_paper.pdf,,yes,https://github.com/shikiw/Modality-Integration-Rate
"FPEM: Face Prior Enhanced Facial Attractiveness Prediction for Live Videos with Face Retouching",https://openaccess.thecvf.com/content/ICCV2025/papers/Li_FPEM_Face_Prior_Enhanced_Facial_Attractiveness_Prediction_for_Live_Videos_ICCV_2025_paper.pdf,,yes,https://github.com/Estella-LH/FPEM
"MultiverSeg: Scalable Interactive Segmentation of Biomedical Imaging Datasets with In-Context Guidance",https://openaccess.thecvf.com/content/ICCV2025/papers/Wong_MultiverSeg_Scalable_Interactive_Segmentation_of_Biomedical_Imaging_Datasets_with_In-Context_ICCV_2025_paper.pdf,http://arxiv.org/abs/2412.15058,maybe,
"Is Meta-Learning Out? Rethinking Unsupervised Few-Shot Classification with Limited Entropy",https://openaccess.thecvf.com/content/ICCV2025/papers/Guan_Is_Meta-Learning_Out_Rethinking_Unsupervised_Few-Shot_Classification_with_Limited_Entropy_ICCV_2025_paper.pdf,http://arxiv.org/abs/2509.13185,no,
"Synergistic Prompting for Robust Visual Recognition with Missing Modalities",https://openaccess.thecvf.com/content/ICCV2025/papers/Zhang_Synergistic_Prompting_for_Robust_Visual_Recognition_with_Missing_Modalities_ICCV_2025_paper.pdf,http://arxiv.org/abs/2507.07802,maybe,
"DAMap: Distance-aware MapNet for High Quality HD Map Construction",https://openaccess.thecvf.com/content/ICCV2025/papers/Dong_DAMap_Distance-aware_MapNet_for_High_Quality_HD_Map_Construction_ICCV_2025_paper.pdf,,no,
"Magic Insert: Style-Aware Drag-and-Drop",https://openaccess.thecvf.com/content/ICCV2025/papers/Ruiz_Magic_Insert_Style-Aware_Drag-and-Drop_ICCV_2025_paper.pdf,http://arxiv.org/abs/2407.02489,no,
"ProGait: A Multi-Purpose Video Dataset and Benchmark for Transfemoral Prosthesis Users",https://openaccess.thecvf.com/content/ICCV2025/papers/Yin_ProGait_A_Multi-Purpose_Video_Dataset_and_Benchmark_for_Transfemoral_Prosthesis_ICCV_2025_paper.pdf,http://arxiv.org/abs/2507.10223,yes,https://github.com/pittisl/ProGait
"MuGS: Multi-Baseline Generalizable Gaussian Splatting Reconstruction",https://openaccess.thecvf.com/content/ICCV2025/papers/Lou_MuGS_Multi-Baseline_Generalizable_Gaussian_Splatting_Reconstruction_ICCV_2025_paper.pdf,http://arxiv.org/abs/2508.04297,yes,https://github.com/EuclidLou/MuGS
"HADES: Human Avatar with Dynamic Explicit Hair Strands",https://openaccess.thecvf.com/content/ICCV2025/papers/Liao_HADES_Human_Avatar_with_Dynamic_Explicit_Hair_Strands_ICCV_2025_paper.pdf,,no,
"Aligning Effective Tokens with Video Anomaly in Large Language Models",https://openaccess.thecvf.com/content/ICCV2025/papers/Chen_Aligning_Effective_Tokens_with_Video_Anomaly_in_Large_Language_Models_ICCV_2025_paper.pdf,,no,
"PseudoMapTrainer: Learning Online Mapping without HD Maps",https://openaccess.thecvf.com/content/ICCV2025/papers/Lowens_PseudoMapTrainer_Learning_Online_Mapping_without_HD_Maps_ICCV_2025_paper.pdf,,maybe,
"From Reflection to Perfection: Scaling Inference-Time Optimization for Text-to-Image Diffusion Models via Reflection Tuning",https://openaccess.thecvf.com/content/ICCV2025/papers/Zhuo_From_Reflection_to_Perfection_Scaling_Inference-Time_Optimization_for_Text-to-Image_Diffusion_ICCV_2025_paper.pdf,http://arxiv.org/abs/2504.16080,maybe,
"FreeDance: Towards Harmonic Free-Number Group Dance Generation via a Unified Framework",https://openaccess.thecvf.com/content/ICCV2025/papers/Zhao_FreeDance_Towards_Harmonic_Free-Number_Group_Dance_Generation_via_a_Unified_ICCV_2025_paper.pdf,,yes,https://github.com/Tsukasane/FreeDance
"Beyond the Frame: Generating 360deg Panoramic Videos from Perspective Videos",https://openaccess.thecvf.com/content/ICCV2025/papers/Luo_Beyond_the_Frame_Generating_360deg_Panoramic_Videos_from_Perspective_Videos_ICCV_2025_paper.pdf,,no,
"Multi-turn Consistent Image Editing",https://openaccess.thecvf.com/content/ICCV2025/papers/Zhou_Multi-turn_Consistent_Image_Editing_ICCV_2025_paper.pdf,http://arxiv.org/abs/2505.04320,maybe,
"HUMOTO: A 4D Dataset of Mocap Human Object Interactions",https://openaccess.thecvf.com/content/ICCV2025/papers/Lu_HUMOTO_A_4D_Dataset_of_Mocap_Human_Object_Interactions_ICCV_2025_paper.pdf,http://arxiv.org/abs/2504.10414,no,
"Learning Visual Hierarchies in Hyperbolic Space for Image Retrieval",https://openaccess.thecvf.com/content/ICCV2025/papers/Wang_Learning_Visual_Hierarchies_in_Hyperbolic_Space_for_Image_Retrieval_ICCV_2025_paper.pdf,http://arxiv.org/abs/2411.17490,no,
"AutoPrompt: Automated Red-Teaming of Text-to-Image Models via LLM-Driven Adversarial Prompts",https://openaccess.thecvf.com/content/ICCV2025/papers/Liu_AutoPrompt_Automated_Red-Teaming_of_Text-to-Image_Models_via_LLM-Driven_Adversarial_Prompts_ICCV_2025_paper.pdf,,no,
"LLM-assisted Entropy-based Adaptive Distillation for Unsupervised Fine-grained Visual Representation Learning",https://openaccess.thecvf.com/content/ICCV2025/papers/Dong_LLM-assisted_Entropy-based_Adaptive_Distillation_for_Unsupervised_Fine-grained_Visual_Representation_Learning_ICCV_2025_paper.pdf,,maybe,
"Jailbreaking Multimodal Large Language Models via Shuffle Inconsistency",https://openaccess.thecvf.com/content/ICCV2025/papers/Zhao_Jailbreaking_Multimodal_Large_Language_Models_via_Shuffle_Inconsistency_ICCV_2025_paper.pdf,http://arxiv.org/abs/2501.04931,maybe,
"UMDATrack: Unified Multi-Domain Adaptive Tracking Under Adverse Weather Conditions",https://openaccess.thecvf.com/content/ICCV2025/papers/Yao_UMDATrack_Unified_Multi-Domain_Adaptive_Tracking_Under_Adverse_Weather_Conditions_ICCV_2025_paper.pdf,http://arxiv.org/abs/2507.00648,yes,https://github.com/Z-Z188/UMDATrack
"Boosting MLLM Reasoning with Text-Debiased Hint-GRPO",https://openaccess.thecvf.com/content/ICCV2025/papers/Huang_Boosting_MLLM_Reasoning_with_Text-Debiased_Hint-GRPO_ICCV_2025_paper.pdf,http://arxiv.org/abs/2503.23905,yes,https://github.com/hqhQAQ/Hint-GRPO
"Learning on the Go: A Meta-learning Object Navigation Model",https://openaccess.thecvf.com/content/ICCV2025/papers/Qin_Learning_on_the_Go_A_Meta-learning_Object_Navigation_Model_ICCV_2025_paper.pdf,,no,
"Visual Interestingness Decoded: How GPT-4o Mirrors Human Interests",https://openaccess.thecvf.com/content/ICCV2025/papers/Abdullahu_Visual_Interestingness_Decoded_How_GPT-4o_Mirrors_Human_Interests_ICCV_2025_paper.pdf,,no,
"PriOr-Flow: Enhancing Primitive Panoramic Optical Flow with Orthogonal View",https://openaccess.thecvf.com/content/ICCV2025/papers/Liu_PriOr-Flow_Enhancing_Primitive_Panoramic_Optical_Flow_with_Orthogonal_View_ICCV_2025_paper.pdf,,no,
"A Simple yet Mighty Hartley Diffusion Versatilist for Generalizable Dense Vision Tasks",https://openaccess.thecvf.com/content/ICCV2025/papers/Bi_A_Simple_yet_Mighty_Hartley_Diffusion_Versatilist_for_Generalizable_Dense_ICCV_2025_paper.pdf,,no,
"Separation for Better Integration: Disentangling Edge and Motion in Event-based Deblurring",https://openaccess.thecvf.com/content/ICCV2025/papers/Zhu_Separation_for_Better_Integration_Disentangling_Edge_and_Motion_in_Event-based_ICCV_2025_paper.pdf,,maybe,
"Bitrate-Controlled Diffusion for Disentangling Motion and Content in Video",https://openaccess.thecvf.com/content/ICCV2025/papers/Li_Bitrate-Controlled_Diffusion_for_Disentangling_Motion_and_Content_in_Video_ICCV_2025_paper.pdf,http://arxiv.org/abs/2509.08376,no,
"LGA-Net: Learning Local and Global Affinities for Sparse Scribble based Image Colorization",https://openaccess.thecvf.com/content/ICCV2025/papers/Lyu_LGA-Net_Learning_Local_and_Global_Affinities_for_Sparse_Scribble_based_ICCV_2025_paper.pdf,,no,
"Benchmarking Burst Super-Resolution for Polarization Images: Noise Dataset and Analysis",https://openaccess.thecvf.com/content/ICCV2025/papers/Hwang_Benchmarking_Burst_Super-Resolution_for_Polarization_Images_Noise_Dataset_and_Analysis_ICCV_2025_paper.pdf,http://arxiv.org/abs/2503.18705,yes,https://github.com/KAIST-VCLAB/polarns
"JointDiT: Enhancing RGB-Depth Joint Modeling with Diffusion Transformers",https://openaccess.thecvf.com/content/ICCV2025/papers/Byung-Ki_JointDiT_Enhancing_RGB-Depth_Joint_Modeling_with_Diffusion_Transformers_ICCV_2025_paper.pdf,http://arxiv.org/abs/2505.00482,yes,https://github.com/kaist-ami/JointDiT
"Discretized Gaussian Representation for Tomographic Reconstruction",https://openaccess.thecvf.com/content/ICCV2025/papers/Wu_Discretized_Gaussian_Representation_for_Tomographic_Reconstruction_ICCV_2025_paper.pdf,,yes,https://github.com/wskingdom/DGR
"ScoreHOI: Physically Plausible Reconstruction of Human-Object Interaction via Score-Guided Diffusion",https://openaccess.thecvf.com/content/ICCV2025/papers/Li_ScoreHOI_Physically_Plausible_Reconstruction_of_Human-Object_Interaction_via_Score-Guided_Diffusion_ICCV_2025_paper.pdf,http://arxiv.org/abs/2509.07920,no,
"CMB-ML: A Cosmic Microwave Background Dataset for the Oldest Possible Computer Vision Task",https://openaccess.thecvf.com/content/ICCV2025/papers/Amato_CMB-ML_A_Cosmic_Microwave_Background_Dataset_for_the_Oldest_Possible_ICCV_2025_paper.pdf,,no,
"Deeply Supervised Flow-Based Generative Models",https://openaccess.thecvf.com/content/ICCV2025/papers/Shin_Deeply_Supervised_Flow-Based_Generative_Models_ICCV_2025_paper.pdf,http://arxiv.org/abs/2503.14494,no,
"Towards Efficient General Feature Prediction in Masked Skeleton Modeling",https://openaccess.thecvf.com/content/ICCV2025/papers/Sun_Towards_Efficient_General_Feature_Prediction_in_Masked_Skeleton_Modeling_ICCV_2025_paper.pdf,http://arxiv.org/abs/2509.03609,no,
"Dynamic Point Maps: A Versatile Representation for Dynamic 3D Reconstruction",https://openaccess.thecvf.com/content/ICCV2025/papers/Sucar_Dynamic_Point_Maps_A_Versatile_Representation_for_Dynamic_3D_Reconstruction_ICCV_2025_paper.pdf,http://arxiv.org/abs/2503.16318,no,
"Language Decoupling with Fine-grained Knowledge Guidance for Referring Multi-object Tracking",https://openaccess.thecvf.com/content/ICCV2025/papers/Li_Language_Decoupling_with_Fine-grained_Knowledge_Guidance_for_Referring_Multi-object_Tracking_ICCV_2025_paper.pdf,,no,
"Timestep-Aware Diffusion Model for Extreme Image Rescaling",https://openaccess.thecvf.com/content/ICCV2025/papers/Wang_Timestep-Aware_Diffusion_Model_for_Extreme_Image_Rescaling_ICCV_2025_paper.pdf,http://arxiv.org/abs/2408.09151,yes,https://github.com/wwangcece/TADM
"COVTrack: Continuous Open-Vocabulary Tracking via Adaptive Multi-Cue Fusion",https://openaccess.thecvf.com/content/ICCV2025/papers/Qian_COVTrack_Continuous_Open-Vocabulary_Tracking_via_Adaptive_Multi-Cue_Fusion_ICCV_2025_paper.pdf,,no,
"Toward Material-Agnostic System Identification from Videos",https://openaccess.thecvf.com/content/ICCV2025/papers/Zhao_Toward_Material-Agnostic_System_Identification_from_Videos_ICCV_2025_paper.pdf,http://arxiv.org/abs/2508.01112,no,
"Referring Expression Comprehension for Small Objects",https://openaccess.thecvf.com/content/ICCV2025/papers/Goto_Referring_Expression_Comprehension_for_Small_Objects_ICCV_2025_paper.pdf,http://arxiv.org/abs/2510.03701,no,
"Robust 3D-Masked Part-level Editing in 3D Gaussian Splatting with Regularized Score Distillation Sampling",https://openaccess.thecvf.com/content/ICCV2025/papers/Kim_Robust_3D-Masked_Part-level_Editing_in_3D_Gaussian_Splatting_with_Regularized_ICCV_2025_paper.pdf,http://arxiv.org/abs/2507.11061,maybe,
"InstaDrive: Instance-Aware Driving World Models for Realistic and Consistent Video Generation",https://openaccess.thecvf.com/content/ICCV2025/papers/Yang_InstaDrive_Instance-Aware_Driving_World_Models_for_Realistic_and_Consistent_Video_ICCV_2025_paper.pdf,,no,
"Effective Training Data Synthesis for Improving MLLM Chart Understanding",https://openaccess.thecvf.com/content/ICCV2025/papers/Yang_Effective_Training_Data_Synthesis_for_Improving_MLLM_Chart_Understanding_ICCV_2025_paper.pdf,http://arxiv.org/abs/2508.06492,yes,https://github.com/yuweiyang-anu/ECD
"DIVE: Taming DINO for Subject-Driven Video Editing",https://openaccess.thecvf.com/content/ICCV2025/papers/Huang_DIVE_Taming_DINO_for_Subject-Driven_Video_Editing_ICCV_2025_paper.pdf,http://arxiv.org/abs/2412.03347,no,
"Neural Architecture Search Driven by Locally Guided Diffusion for Personalized Federated Learning",https://openaccess.thecvf.com/content/ICCV2025/papers/Liao_Neural_Architecture_Search_Driven_by_Locally_Guided_Diffusion_for_Personalized_ICCV_2025_paper.pdf,,no,
"Global-Aware Monocular Semantic Scene Completion with State Space Models",https://openaccess.thecvf.com/content/ICCV2025/papers/Li_Global-Aware_Monocular_Semantic_Scene_Completion_with_State_Space_Models_ICCV_2025_paper.pdf,http://arxiv.org/abs/2503.06569,maybe,
"ULTHO: Ultra-Lightweight yet Efficient Hyperparameter Optimization in Deep Reinforcement Learning",https://openaccess.thecvf.com/content/ICCV2025/papers/Yuan_ULTHO_Ultra-Lightweight_yet_Efficient_Hyperparameter_Optimization_in_Deep_Reinforcement_Learning_ICCV_2025_paper.pdf,http://arxiv.org/abs/2503.06101,no,
"GReg: Geometry-Aware Region Refinement for Sign Language Video Generation",https://openaccess.thecvf.com/content/ICCV2025/papers/Shi_GReg_Geometry-Aware_Region_Refinement_for_Sign_Language_Video_Generation_ICCV_2025_paper.pdf,,no,
"CarGait: Cross-Attention based Re-ranking for Gait recognition",https://openaccess.thecvf.com/content/ICCV2025/papers/Habib_CarGait_Cross-Attention_based_Re-ranking_for_Gait_recognition_ICCV_2025_paper.pdf,http://arxiv.org/abs/2503.03501,no,
"Text2VDM: Text to Vector Displacement Maps for Expressive and Interactive 3D Sculpting",https://openaccess.thecvf.com/content/ICCV2025/papers/Meng_Text2VDM_Text_to_Vector_Displacement_Maps_for_Expressive_and_Interactive_ICCV_2025_paper.pdf,http://arxiv.org/abs/2502.20045,no,
"DiffVSR: Revealing an Effective Recipe for Taming Robust Video Super-Resolution Against Complex Degradations",https://openaccess.thecvf.com/content/ICCV2025/papers/Li_DiffVSR_Revealing_an_Effective_Recipe_for_Taming_Robust_Video_Super-Resolution_ICCV_2025_paper.pdf,http://arxiv.org/abs/2501.10110,no,
"3D Gaussian Splatting Driven Multi-View Robust Physical Adversarial Camouflage Generation",https://openaccess.thecvf.com/content/ICCV2025/papers/Lou_3D_Gaussian_Splatting_Driven_Multi-View_Robust_Physical_Adversarial_Camouflage_Generation_ICCV_2025_paper.pdf,http://arxiv.org/abs/2507.01367,yes,https://github.com/TRLou/PGA
"GenieBlue: Integrating both Linguistic and Multimodal Capabilities for Large Language Models on Mobile Devices",https://openaccess.thecvf.com/content/ICCV2025/papers/Lu_GenieBlue_Integrating_both_Linguistic_and_Multimodal_Capabilities_for_Large_Language_ICCV_2025_paper.pdf,http://arxiv.org/abs/2503.06019,no,
"MambaML: Exploring State Space Models for Multi-Label Image Classification",https://openaccess.thecvf.com/content/ICCV2025/papers/Zhu_MambaML_Exploring_State_Space_Models_for_Multi-Label_Image_Classification_ICCV_2025_paper.pdf,,no,
