title,pdf_url,arxiv_url,code_available,code_url
"Interaction-Merged Motion Planning: Effectively Leveraging Diverse Motion Datasets for Robust Planning",https://openaccess.thecvf.com/content/ICCV2025/papers/Lee_Interaction-Merged_Motion_Planning_Effectively_Leveraging_Diverse_Motion_Datasets_for_Robust_ICCV_2025_paper.pdf,http://arxiv.org/abs/2507.04790,no,
"FreeFlux: Understanding and Exploiting Layer-Specific Roles in RoPE-Based MMDiT for Versatile Image Editing",https://openaccess.thecvf.com/content/ICCV2025/papers/Wei_FreeFlux_Understanding_and_Exploiting_Layer-Specific_Roles_in_RoPE-Based_MMDiT_for_ICCV_2025_paper.pdf,http://arxiv.org/abs/2503.16153,no,
"WalkVLM: Aid Visually Impaired People Walking by Vision Language Model",https://openaccess.thecvf.com/content/ICCV2025/papers/Yuan_WalkVLM_Aid_Visually_Impaired_People_Walking_by_Vision_Language_Model_ICCV_2025_paper.pdf,http://arxiv.org/abs/2412.20903,no,
"WildSeg3D: Segment Any 3D Objects in the Wild from 2D Images",https://openaccess.thecvf.com/content/ICCV2025/papers/Guo_WildSeg3D_Segment_Any_3D_Objects_in_the_Wild_from_2D_ICCV_2025_paper.pdf,http://arxiv.org/abs/2503.08407,yes,https://github.com/Ethan16162/WildSeg3D
"CAPTURE: Evaluating Spatial Reasoning in Vision Language Models via Occluded Object Counting",https://openaccess.thecvf.com/content/ICCV2025/papers/Pothiraj_CAPTURE_Evaluating_Spatial_Reasoning_in_Vision_Language_Models_via_Occluded_ICCV_2025_paper.pdf,http://arxiv.org/abs/2504.15485,yes,https://github.com/atinpothiraj/CAPTURe
"DeRIS: Decoupling Perception and Cognition for Enhanced Referring Image Segmentation through Loopback Synergy",https://openaccess.thecvf.com/content/ICCV2025/papers/Dai_DeRIS_Decoupling_Perception_and_Cognition_for_Enhanced_Referring_Image_Segmentation_ICCV_2025_paper.pdf,http://arxiv.org/abs/2507.01738,yes,https://github.com/Dmmm1997/DeRIS
"PersPose: 3D Human Pose Estimation with Perspective Encoding and Perspective Rotation",https://openaccess.thecvf.com/content/ICCV2025/papers/Hao_PersPose_3D_Human_Pose_Estimation_with_Perspective_Encoding_and_Perspective_ICCV_2025_paper.pdf,http://arxiv.org/abs/2508.17239,yes,https://github.com/KenAdamsJoseph/PersPose
"Exploring Multimodal Diffusion Transformers for Enhanced Prompt-based Image Editing",https://openaccess.thecvf.com/content/ICCV2025/papers/Shin_Exploring_Multimodal_Diffusion_Transformers_for_Enhanced_Prompt-based_Image_Editing_ICCV_2025_paper.pdf,http://arxiv.org/abs/2508.07519,no,
"IM-LUT: Interpolation Mixing Look-Up Tables for Image Super-Resolution",https://openaccess.thecvf.com/content/ICCV2025/papers/Park_IM-LUT_Interpolation_Mixing_Look-Up_Tables_for_Image_Super-Resolution_ICCV_2025_paper.pdf,,no,
"TeEFusion: Blending Text Embeddings to Distill Classifier-Free Guidance",https://openaccess.thecvf.com/content/ICCV2025/papers/Fu_TeEFusion_Blending_Text_Embeddings_to_Distill_Classifier-Free_Guidance_ICCV_2025_paper.pdf,http://arxiv.org/abs/2507.18192,yes,https://github.com/AIDC-AI/TeEFusion
"Scaling Omni-modal Pretraining with Multimodal Context: Advancing Universal Representation Learning Across Modalities",https://openaccess.thecvf.com/content/ICCV2025/papers/Zhang_Scaling_Omni-modal_Pretraining_with_Multimodal_Context_Advancing_Universal_Representation_Learning_ICCV_2025_paper.pdf,,no,
"ZIM: Zero-Shot Image Matting for Anything",https://openaccess.thecvf.com/content/ICCV2025/papers/Kim_ZIM_Zero-Shot_Image_Matting_for_Anything_ICCV_2025_paper.pdf,http://arxiv.org/abs/2411.00626,yes,https://github.com/naver-ai/ZIM
"LayerD: Decomposing Raster Graphic Designs into Layers",https://openaccess.thecvf.com/content/ICCV2025/papers/Suzuki_LayerD_Decomposing_Raster_Graphic_Designs_into_Layers_ICCV_2025_paper.pdf,http://arxiv.org/abs/2509.25134,yes,https://github.com/CyberAgentAILab/LayerD
"ALOcc: Adaptive Lifting-Based 3D Semantic Occupancy and Cost Volume-Based Flow Predictions",https://openaccess.thecvf.com/content/ICCV2025/papers/Chen_ALOcc_Adaptive_Lifting-Based_3D_Semantic_Occupancy_and_Cost_Volume-Based_Flow_ICCV_2025_paper.pdf,http://arxiv.org/abs/2411.07725,no,
"Heuristic-Induced Multimodal Risk Distribution Jailbreak Attack for Multimodal Large Language Models",https://openaccess.thecvf.com/content/ICCV2025/papers/Ma_Heuristic-Induced_Multimodal_Risk_Distribution_Jailbreak_Attack_for_Multimodal_Large_Language_ICCV_2025_paper.pdf,http://arxiv.org/abs/2412.05934,yes,https://github.com/MaTengSYSU/HIMRD-jailbreak
"Skip-Vision: Efficient and Scalable Acceleration of Vision-Language Models via Adaptive Token Skipping",https://openaccess.thecvf.com/content/ICCV2025/papers/Zeng_Skip-Vision_Efficient_and_Scalable_Acceleration_of_Vision-Language_Models_via_Adaptive_ICCV_2025_paper.pdf,,no,
"Enrich and Detect: Video Temporal Grounding with Multimodal LLMs",https://openaccess.thecvf.com/content/ICCV2025/papers/Pramanick_Enrich_and_Detect_Video_Temporal_Grounding_with_Multimodal_LLMs_ICCV_2025_paper.pdf,,no,
"Class Token as Proxy: Optimal Transport-assisted Proxy Learning for Weakly Supervised Semantic Segmentation",https://openaccess.thecvf.com/content/ICCV2025/papers/Wang_Class_Token_as_Proxy_Optimal_Transport-assisted_Proxy_Learning_for_Weakly_ICCV_2025_paper.pdf,,no,
"DexVLG: Dexterous Vision-Language-Grasp Model at Scale",https://openaccess.thecvf.com/content/ICCV2025/papers/He_DexVLG_Dexterous_Vision-Language-Grasp_Model_at_Scale_ICCV_2025_paper.pdf,http://arxiv.org/abs/2507.02747,no,
"FIND: Few-Shot Anomaly Inspection with Normal-Only Multi-Modal Data",https://openaccess.thecvf.com/content/ICCV2025/papers/Li_FIND_Few-Shot_Anomaly_Inspection_with_Normal-Only_Multi-Modal_Data_ICCV_2025_paper.pdf,,no,
"MaskSAM: Auto-prompt SAM with Mask Classification for Volumetric Medical Image Segmentation",https://openaccess.thecvf.com/content/ICCV2025/papers/Xie_MaskSAM_Auto-prompt_SAM_with_Mask_Classification_for_Volumetric_Medical_Image_ICCV_2025_paper.pdf,,yes,https://github.com/bxie9/MaskSAM
"Boundary Probing for Input Privacy Protection When Using LMM Services",https://openaccess.thecvf.com/content/ICCV2025/papers/Hui_Boundary_Probing_for_Input_Privacy_Protection_When_Using_LMM_Services_ICCV_2025_paper.pdf,,no,
"Knowledge Distillation with Refined Logits",https://openaccess.thecvf.com/content/ICCV2025/papers/Sun_Knowledge_Distillation_with_Refined_Logits_ICCV_2025_paper.pdf,http://arxiv.org/abs/2408.07703,yes,https://github.com/zju-SWJ/RLD
"Tracking Tiny Drones against Clutter: Large-Scale Infrared Benchmark with Motion-Centric Adaptive Algorithm",https://openaccess.thecvf.com/content/ICCV2025/papers/Zhang_Tracking_Tiny_Drones_against_Clutter_Large-Scale_Infrared_Benchmark_with_Motion-Centric_ICCV_2025_paper.pdf,,yes,https://github.com/zhangjiahao02/MCATrack
"AID: Adapting Image2Video Diffusion Models for Instruction-guided Video Prediction",https://openaccess.thecvf.com/content/ICCV2025/papers/Xing_AID_Adapting_Image2Video_Diffusion_Models_for_Instruction-guided_Video_Prediction_ICCV_2025_paper.pdf,http://arxiv.org/abs/2406.06465,no,
"Enhancing Few-Shot Vision-Language Classification with Large Multimodal Model Features",https://openaccess.thecvf.com/content/ICCV2025/papers/Mitra_Enhancing_Few-Shot_Vision-Language_Classification_with_Large_Multimodal_Model_Features_ICCV_2025_paper.pdf,http://arxiv.org/abs/2412.00142,no,
"DeepShield: Fortifying Deepfake Video Detection with Local and Global Forgery Analysis",https://openaccess.thecvf.com/content/ICCV2025/papers/Cai_DeepShield_Fortifying_Deepfake_Video_Detection_with_Local_and_Global_Forgery_ICCV_2025_paper.pdf,,no,
"Synthesizing Near-Boundary OOD Samples for Out-of-Distribution Detection",https://openaccess.thecvf.com/content/ICCV2025/papers/Li_Synthesizing_Near-Boundary_OOD_Samples_for_Out-of-Distribution_Detection_ICCV_2025_paper.pdf,http://arxiv.org/abs/2507.10225,yes,https://github.com/Jarvisgivemeasuit/SynOOD
"Splat-based 3D Scene Reconstruction with Extreme Motion-blur",https://openaccess.thecvf.com/content/ICCV2025/papers/Jang_Splat-based_3D_Scene_Reconstruction_with_Extreme_Motion-blur_ICCV_2025_paper.pdf,,maybe,
"Towards Robustness of Person Search against Corruptions",https://openaccess.thecvf.com/content/ICCV2025/papers/Son_Towards_Robustness_of_Person_Search_against_Corruptions_ICCV_2025_paper.pdf,,no,
"INSTINCT: Instance-Level Interaction Architecture for Query-Based Collaborative Perception",https://openaccess.thecvf.com/content/ICCV2025/papers/Xu_INSTINCT_Instance-Level_Interaction_Architecture_for_Query-Based_Collaborative_Perception_ICCV_2025_paper.pdf,http://arxiv.org/abs/2509.23700,yes,https://github.com/CrazyShout/INSTINCT
"DriveX: Omni Scene Modeling for Learning Generalizable World Knowledge in Autonomous Driving",https://openaccess.thecvf.com/content/ICCV2025/papers/Shi_DriveX_Omni_Scene_Modeling_for_Learning_Generalizable_World_Knowledge_in_ICCV_2025_paper.pdf,http://arxiv.org/abs/2505.19239,no,
"MagicCity: Geometry-Aware 3D City Generation from Satellite Imagery with Multi-View Consistency",https://openaccess.thecvf.com/content/ICCV2025/papers/Yao_MagicCity_Geometry-Aware_3D_City_Generation_from_Satellite_Imagery_with_Multi-View_ICCV_2025_paper.pdf,,maybe,
"EDFFDNet: Towards Accurate and Efficient Unsupervised Multi-Grid Image Registration",https://openaccess.thecvf.com/content/ICCV2025/papers/Zhu_EDFFDNet_Towards_Accurate_and_Efficient_Unsupervised_Multi-Grid_Image_Registration_ICCV_2025_paper.pdf,http://arxiv.org/abs/2509.07662,no,
"RadGPT: Constructing 3D Image-Text Tumor Datasets",https://openaccess.thecvf.com/content/ICCV2025/papers/Bassi_RadGPT_Constructing_3D_Image-Text_Tumor_Datasets_ICCV_2025_paper.pdf,,no,
"Adaptive Prompt Learning via Gaussian Outlier Synthesis for Out-of-distribution Detection",https://openaccess.thecvf.com/content/ICCV2025/papers/Zhang_Adaptive_Prompt_Learning_via_Gaussian_Outlier_Synthesis_for_Out-of-distribution_Detection_ICCV_2025_paper.pdf,,no,
"LangBridge: Interpreting Image as a Combination of Language Embeddings",https://openaccess.thecvf.com/content/ICCV2025/papers/Liao_LangBridge_Interpreting_Image_as_a_Combination_of_Language_Embeddings_ICCV_2025_paper.pdf,http://arxiv.org/abs/2503.19404,no,
"Anchor Token Matching: Implicit Structure Locking for Training-free AR Image Editing",https://openaccess.thecvf.com/content/ICCV2025/papers/Hu_Anchor_Token_Matching_Implicit_Structure_Locking_for_Training-free_AR_Image_ICCV_2025_paper.pdf,http://arxiv.org/abs/2504.10434,yes,https://github.com/hutaiHang/ATM
"ArgoTweak: Towards Self-Updating HD Maps through Structured Priors",https://openaccess.thecvf.com/content/ICCV2025/papers/Wild_ArgoTweak_Towards_Self-Updating_HD_Maps_through_Structured_Priors_ICCV_2025_paper.pdf,http://arxiv.org/abs/2509.08764,no,
"FedMVP: Federated Multimodal Visual Prompt Tuning for Vision-Language Models",https://openaccess.thecvf.com/content/ICCV2025/papers/Singha_FedMVP_Federated_Multimodal_Visual_Prompt_Tuning_for_Vision-Language_Models_ICCV_2025_paper.pdf,http://arxiv.org/abs/2504.20860,yes,https://github.com/mainaksingha01/FedMVP
"Robust Dataset Condensation using Supervised Contrastive Learning",https://openaccess.thecvf.com/content/ICCV2025/papers/Kim_Robust_Dataset_Condensation_using_Supervised_Contrastive_Learning_ICCV_2025_paper.pdf,,yes,https://github.com/DISL-Lab/RDC-ICCV2025
"TIP-I2V: A Million-Scale Real Text and Image Prompt Dataset for Image-to-Video Generation",https://openaccess.thecvf.com/content/ICCV2025/papers/Wang_TIP-I2V_A_Million-Scale_Real_Text_and_Image_Prompt_Dataset_for_ICCV_2025_paper.pdf,,no,
"From Reusing to Forecasting: Accelerating Diffusion Models with TaylorSeers",https://openaccess.thecvf.com/content/ICCV2025/papers/Liu_From_Reusing_to_Forecasting_Accelerating_Diffusion_Models_with_TaylorSeers_ICCV_2025_paper.pdf,http://arxiv.org/abs/2503.06923,yes,https://github.com/Shenyi-Z/TaylorSeer
"VisNumBench: Evaluating Number Sense of Multimodal Large Language Models",https://openaccess.thecvf.com/content/ICCV2025/papers/Weng_VisNumBench_Evaluating_Number_Sense_of_Multimodal_Large_Language_Models_ICCV_2025_paper.pdf,http://arxiv.org/abs/2503.14939,maybe,
"Invisible Watermarks; Visible Gains: Steering Machine Unlearning with Bi-Level Watermarking Design",https://openaccess.thecvf.com/content/ICCV2025/papers/Sun_Invisible_Watermarks_Visible_Gains_Steering_Machine_Unlearning_with_Bi-Level_Watermarking_ICCV_2025_paper.pdf,http://arxiv.org/abs/2508.10065,no,
"FICGen: Frequency-Inspired Contextual Disentanglement for Layout-driven Degraded Image Generation",https://openaccess.thecvf.com/content/ICCV2025/papers/Wang_FICGen_Frequency-Inspired_Contextual_Disentanglement_for_Layout-driven_Degraded_Image_Generation_ICCV_2025_paper.pdf,http://arxiv.org/abs/2509.01107,no,
"Quantifying and Narrowing the Unknown: Interactive Text-to-Video Retrieval via Uncertainty Minimization",https://openaccess.thecvf.com/content/ICCV2025/papers/Zhang_Quantifying_and_Narrowing_the_Unknown_Interactive_Text-to-Video_Retrieval_via_Uncertainty_ICCV_2025_paper.pdf,http://arxiv.org/abs/2507.15504,no,
"ShortV: Efficient Multimodal Large Language Models by Freezing Visual Tokens in Ineffective Layers",https://openaccess.thecvf.com/content/ICCV2025/papers/Yuan_ShortV_Efficient_Multimodal_Large_Language_Models_by_Freezing_Visual_Tokens_ICCV_2025_paper.pdf,http://arxiv.org/abs/2504.00502,yes,https://github.com/icip-cas/ShortV
"SpikeDiff: Zero-shot High-Quality Video Reconstruction from Chromatic Spike Camera and Sub-millisecond Spike Streams",https://openaccess.thecvf.com/content/ICCV2025/papers/Yang_SpikeDiff_Zero-shot_High-Quality_Video_Reconstruction_from_Chromatic_Spike_Camera_and_ICCV_2025_paper.pdf,,no,
"Selective Contrastive Learning for Weakly Supervised Affordance Grounding",https://openaccess.thecvf.com/content/ICCV2025/papers/Moon_Selective_Contrastive_Learning_for_Weakly_Supervised_Affordance_Grounding_ICCV_2025_paper.pdf,http://arxiv.org/abs/2508.07877,yes,http://github.com/hynnsk/SelectiveCL
"GECKO: Gigapixel Vision-Concept Contrastive Pretraining in Histopathology",https://openaccess.thecvf.com/content/ICCV2025/papers/Kapse_GECKO_Gigapixel_Vision-Concept_Contrastive_Pretraining_in_Histopathology_ICCV_2025_paper.pdf,http://arxiv.org/abs/2504.01009,yes,https://github.com/bmi-imaginelab/GECKO
"Single-Scanline Relative Pose Estimation for Rolling Shutter Cameras",https://openaccess.thecvf.com/content/ICCV2025/papers/Hruby_Single-Scanline_Relative_Pose_Estimation_for_Rolling_Shutter_Cameras_ICCV_2025_paper.pdf,http://arxiv.org/abs/2506.22069,no,
"Compression of 3D Gaussian Splatting with Optimized Feature Planes and Standard Video Codecs",https://openaccess.thecvf.com/content/ICCV2025/papers/Lee_Compression_of_3D_Gaussian_Splatting_with_Optimized_Feature_Planes_and_ICCV_2025_paper.pdf,http://arxiv.org/abs/2501.03399,no,
"CULTURE3D: A Large-Scale and Diverse Dataset of Cultural Landmarks and Terrains for Gaussian-Based Scene Rendering",https://openaccess.thecvf.com/content/ICCV2025/papers/Zheng_CULTURE3D_A_Large-Scale_and_Diverse_Dataset_of_Cultural_Landmarks_and_ICCV_2025_paper.pdf,http://arxiv.org/abs/2501.06927,maybe,
"Real3D: Towards Scaling Large Reconstruction Models with Real Images",https://openaccess.thecvf.com/content/ICCV2025/papers/Jiang_Real3D_Towards_Scaling_Large_Reconstruction_Models_with_Real_Images_ICCV_2025_paper.pdf,,no,
"FA: Forced Prompt Learning of Vision-Language Models for Out-of-Distribution Detection",https://openaccess.thecvf.com/content/ICCV2025/papers/Lu_FA_Forced_Prompt_Learning_of_Vision-Language_Models_for_Out-of-Distribution_Detection_ICCV_2025_paper.pdf,http://arxiv.org/abs/2507.04511,yes,https://github.com/0xFAFA/FA
"Geo4D: Leveraging Video Generators for Geometric 4D Scene Reconstruction",https://openaccess.thecvf.com/content/ICCV2025/papers/Jiang_Geo4D_Leveraging_Video_Generators_for_Geometric_4D_Scene_Reconstruction_ICCV_2025_paper.pdf,http://arxiv.org/abs/2504.07961,no,
"REPARO: Compositional 3D Assets Generation with Differentiable 3D Layout Alignment",https://openaccess.thecvf.com/content/ICCV2025/papers/Han_REPARO_Compositional_3D_Assets_Generation_with_Differentiable_3D_Layout_Alignment_ICCV_2025_paper.pdf,http://arxiv.org/abs/2405.18525,no,
"VACE: All-in-One Video Creation and Editing",https://openaccess.thecvf.com/content/ICCV2025/papers/Jiang_VACE_All-in-One_Video_Creation_and_Editing_ICCV_2025_paper.pdf,http://arxiv.org/abs/2503.07598,no,
"SparseMM: Head Sparsity Emerges from Visual Concept Responses in MLLMs",https://openaccess.thecvf.com/content/ICCV2025/papers/Wang_SparseMM_Head_Sparsity_Emerges_from_Visual_Concept_Responses_in_MLLMs_ICCV_2025_paper.pdf,http://arxiv.org/abs/2506.05344,yes,https://github.com/CR400AF-A/SparseMM
"Focal Plane Visual Feature Generation and Matching on a Pixel Processor Array",https://openaccess.thecvf.com/content/ICCV2025/papers/Zhang_Focal_Plane_Visual_Feature_Generation_and_Matching_on_a_Pixel_ICCV_2025_paper.pdf,,no,
"Q-Frame: Query-aware Frame Selection and Multi-Resolution Adaptation for Video-LLMs",https://openaccess.thecvf.com/content/ICCV2025/papers/Zhang_Q-Frame_Query-aware_Frame_Selection_and_Multi-Resolution_Adaptation_for_Video-LLMs_ICCV_2025_paper.pdf,,no,
"Prompt-driven Transferable Adversarial Attack on Person Re-Identification with Attribute-aware Textual Inversion",https://openaccess.thecvf.com/content/ICCV2025/papers/Bian_Prompt-driven_Transferable_Adversarial_Attack_on_Person_Re-Identification_with_Attribute-aware_Textual_ICCV_2025_paper.pdf,http://arxiv.org/abs/2502.19697,no,
"OV-SCAN: Semantically Consistent Alignment for Novel Object Discovery in Open-Vocabulary 3D Object Detection",https://openaccess.thecvf.com/content/ICCV2025/papers/Chow_OV-SCAN_Semantically_Consistent_Alignment_for_Novel_Object_Discovery_in_Open-Vocabulary_ICCV_2025_paper.pdf,,no,
"ContextFace: Generating Facial Expressions from Emotional Contexts",https://openaccess.thecvf.com/content/ICCV2025/papers/Kim_ContextFace_Generating_Facial_Expressions_from_Emotional_Contexts_ICCV_2025_paper.pdf,,no,
"MDP-Omni: Parameter-free Multimodal Depth Prior-based Sampling for Omnidirectional Stereo Matching",https://openaccess.thecvf.com/content/ICCV2025/papers/Son_MDP-Omni_Parameter-free_Multimodal_Depth_Prior-based_Sampling_for_Omnidirectional_Stereo_Matching_ICCV_2025_paper.pdf,,no,
"The Inter-Intra Modal Measure: A Predictive Lens on Fine-Tuning Outcomes in Vision-Language Models",https://openaccess.thecvf.com/content/ICCV2025/papers/Niss_The_Inter-Intra_Modal_Measure_A_Predictive_Lens_on_Fine-Tuning_Outcomes_ICCV_2025_paper.pdf,http://arxiv.org/abs/2407.15731,yes,https://github.com/mit-ll/IIMM
"Error Recognition in Procedural Videos using Generalized Task Graph",https://openaccess.thecvf.com/content/ICCV2025/papers/Lee_Error_Recognition_in_Procedural_Videos_using_Generalized_Task_Graph_ICCV_2025_paper.pdf,,no,
"Reangle-A-Video: 4D Video Generation as Video-to-Video Translation",https://openaccess.thecvf.com/content/ICCV2025/papers/Jeong_Reangle-A-Video_4D_Video_Generation_as_Video-to-Video_Translation_ICCV_2025_paper.pdf,,maybe,
"DualReal: Adaptive Joint Training for Lossless Identity-Motion Fusion in Video Customization",https://openaccess.thecvf.com/content/ICCV2025/papers/Wang_DualReal_Adaptive_Joint_Training_for_Lossless_Identity-Motion_Fusion_in_Video_ICCV_2025_paper.pdf,http://arxiv.org/abs/2505.02192,no,
"RoboTron-Sim: Improving Real-World Driving via Simulated Hard-Case",https://openaccess.thecvf.com/content/ICCV2025/papers/Xiao_RoboTron-Sim_Improving_Real-World_Driving_via_Simulated_Hard-Case_ICCV_2025_paper.pdf,,no,
"Towards Scalable Spatial Intelligence via 2D-to-3D Data Lifting",https://openaccess.thecvf.com/content/ICCV2025/papers/Miao_Towards_Scalable_Spatial_Intelligence_via_2D-to-3D_Data_Lifting_ICCV_2025_paper.pdf,http://arxiv.org/abs/2507.18678,no,
"LDIP: Long Distance Information Propagation for Video Super-Resolution",https://openaccess.thecvf.com/content/ICCV2025/papers/Bernasconi_LDIP_Long_Distance_Information_Propagation_for_Video_Super-Resolution_ICCV_2025_paper.pdf,,no,
"Cross-Architecture Distillation Made Simple with Redundancy Suppression",https://openaccess.thecvf.com/content/ICCV2025/papers/Zhang_Cross-Architecture_Distillation_Made_Simple_with_Redundancy_Suppression_ICCV_2025_paper.pdf,http://arxiv.org/abs/2507.21844,no,
"M2EIT: Multi-Domain Mixture of Experts for Robust Neural Inertial Tracking",https://openaccess.thecvf.com/content/ICCV2025/papers/Li_M2EIT_Multi-Domain_Mixture_of_Experts_for_Robust_Neural_Inertial_Tracking_ICCV_2025_paper.pdf,,no,
"ShortFT: Diffusion Model Alignment via Shortcut-based Fine-Tuning",https://openaccess.thecvf.com/content/ICCV2025/papers/Guo_ShortFT_Diffusion_Model_Alignment_via_Shortcut-based_Fine-Tuning_ICCV_2025_paper.pdf,http://arxiv.org/abs/2507.22604,no,
"Who Controls the Authorization? Invertible Networks for Copyright Protection in Text-to-Image Synthesis",https://openaccess.thecvf.com/content/ICCV2025/papers/Hu_Who_Controls_the_Authorization_Invertible_Networks_for_Copyright_Protection_in_ICCV_2025_paper.pdf,,no,
"Identity-aware Language Gaussian Splatting for Open-vocabulary 3D Semantic Segmentation",https://openaccess.thecvf.com/content/ICCV2025/papers/Jang_Identity-aware_Language_Gaussian_Splatting_for_Open-vocabulary_3D_Semantic_Segmentation_ICCV_2025_paper.pdf,,no,
"IDEATOR: Jailbreaking and Benchmarking Large Vision-Language Models Using Themselves",https://openaccess.thecvf.com/content/ICCV2025/papers/Wang_IDEATOR_Jailbreaking_and_Benchmarking_Large_Vision-Language_Models_Using_Themselves_ICCV_2025_paper.pdf,http://arxiv.org/abs/2411.00827,no,
"Degradation-Modeled Multipath Diffusion for Tunable Metalens Photography",https://openaccess.thecvf.com/content/ICCV2025/papers/Zhang_Degradation-Modeled_Multipath_Diffusion_for_Tunable_Metalens_Photography_ICCV_2025_paper.pdf,http://arxiv.org/abs/2506.22753,no,
"Driving View Synthesis on Free-form Trajectories with Generative Prior",https://openaccess.thecvf.com/content/ICCV2025/papers/Yang_Driving_View_Synthesis_on_Free-form_Trajectories_with_Generative_Prior_ICCV_2025_paper.pdf,http://arxiv.org/abs/2412.01717,no,
"AnimeGamer: Infinite Anime Life Simulation with Next Game State Prediction",https://openaccess.thecvf.com/content/ICCV2025/papers/Cheng_AnimeGamer_Infinite_Anime_Life_Simulation_with_Next_Game_State_Prediction_ICCV_2025_paper.pdf,http://arxiv.org/abs/2504.01014,yes,https://github.com/TencentARC/AnimeGamer
"OmniPaint: Mastering Object-Oriented Editing via Disentangled Insertion-Removal Inpainting",https://openaccess.thecvf.com/content/ICCV2025/papers/Yu_OmniPaint_Mastering_Object-Oriented_Editing_via_Disentangled_Insertion-Removal_Inpainting_ICCV_2025_paper.pdf,http://arxiv.org/abs/2503.08677,no,
"UIPro: Unleashing Superior Interaction Capability For GUI Agents",https://openaccess.thecvf.com/content/ICCV2025/papers/Li_UIPro_Unleashing_Superior_Interaction_Capability_For_GUI_Agents_ICCV_2025_paper.pdf,http://arxiv.org/abs/2509.17328,no,
"Class-Wise Federated Averaging for Efficient Personalization",https://openaccess.thecvf.com/content/ICCV2025/papers/Lee_Class-Wise_Federated_Averaging_for_Efficient_Personalization_ICCV_2025_paper.pdf,http://arxiv.org/abs/2406.07800,no,
"StochasticSplats: Stochastic Rasterization for Sorting-Free 3D Gaussian Splatting",https://openaccess.thecvf.com/content/ICCV2025/papers/Kheradmand_StochasticSplats_Stochastic_Rasterization_for_Sorting-Free_3D_Gaussian_Splatting_ICCV_2025_paper.pdf,http://arxiv.org/abs/2503.24366,no,
"A0: An Affordance-Aware Hierarchical Model for General Robotic Manipulation",https://openaccess.thecvf.com/content/ICCV2025/papers/Xu_A0_An_Affordance-Aware_Hierarchical_Model_for_General_Robotic_Manipulation_ICCV_2025_paper.pdf,http://arxiv.org/abs/2504.12636,no,
"FinMMR: Make Financial Numerical Reasoning More Multimodal; Comprehensive; and Challenging",https://openaccess.thecvf.com/content/ICCV2025/papers/Tang_FinMMR_Make_Financial_Numerical_Reasoning_More_Multimodal_Comprehensive_and_Challenging_ICCV_2025_paper.pdf,http://arxiv.org/abs/2508.04625,no,
"A Tiny Change; A Giant Leap: Long-Tailed Class-Incremental Learning via Geometric Prototype Alignment",https://openaccess.thecvf.com/content/ICCV2025/papers/Lai_A_Tiny_Change_A_Giant_Leap_Long-Tailed_Class-Incremental_Learning_via_ICCV_2025_paper.pdf,,yes,https://github.com/laixinyi023/Geometric-Prototype-Alignment
"X-Prompt: Generalizable Auto-Regressive Visual Learning with In-Context Prompting",https://openaccess.thecvf.com/content/ICCV2025/papers/Sun_X-Prompt_Generalizable_Auto-Regressive_Visual_Learning_with_In-Context_Prompting_ICCV_2025_paper.pdf,,no,
"HORT: Monocular Hand-held Objects Reconstruction with Transformers",https://openaccess.thecvf.com/content/ICCV2025/papers/Chen_HORT_Monocular_Hand-held_Objects_Reconstruction_with_Transformers_ICCV_2025_paper.pdf,http://arxiv.org/abs/2503.21313,no,
"Early Timestep Zero-Shot Candidate Selection for Instruction-Guided Image Editing",https://openaccess.thecvf.com/content/ICCV2025/papers/Kim_Early_Timestep_Zero-Shot_Candidate_Selection_for_Instruction-Guided_Image_Editing_ICCV_2025_paper.pdf,http://arxiv.org/abs/2504.13490,no,
"Identity Preserving 3D Head Stylization with Multiview Score Distillation",https://openaccess.thecvf.com/content/ICCV2025/papers/Bilecen_Identity_Preserving_3D_Head_Stylization_with_Multiview_Score_Distillation_ICCV_2025_paper.pdf,,no,
"Aligning Information Capacity Between Vision and Language via Dense-to-Sparse Feature Distillation for Image-Text Matching",https://openaccess.thecvf.com/content/ICCV2025/papers/Liu_Aligning_Information_Capacity_Between_Vision_and_Language_via_Dense-to-Sparse_Feature_ICCV_2025_paper.pdf,http://arxiv.org/abs/2503.14953,no,
"A Lesson in Splats: Teacher-Guided Diffusion for 3D Gaussian Splats Generation with 2D Supervision",https://openaccess.thecvf.com/content/ICCV2025/papers/Peng_A_Lesson_in_Splats_Teacher-Guided_Diffusion_for_3D_Gaussian_Splats_ICCV_2025_paper.pdf,http://arxiv.org/abs/2412.00623,no,
